{
  "mode": "area_occupancy",
  "model_name": "yolo26s.pt",
  "imgsz": [
    1088,
    1920
  ],
  "confidence_threshold": 0.2,
  "deduplication_enabled": true,
  "iou_threshold": 0.45,
  "containment_threshold": 0.65,
  "tracking_enabled": false,
  "lost_track_buffer": 30,
  "smoothing_frames": 5,
  "show_boxes": false,
  "show_labels": false,
  "dining_zone": [
    [
      0.0,
      0.12
    ],
    [
      1.0,
      0.12
    ],
    [
      1.0,
      0.98
    ],
    [
      0.0,
      0.98
    ]
  ],
  "shadow_zone": {
    "enabled": false,
    "start": [
      1.0,
      0.48
    ],
    "end": [
      0.82,
      0.17
    ],
    "confidence_threshold": 0.11
  },
  "max_capacity": 60,
  "warning_capacity": 45,
  "smoothing_window_sec": 4.0,
  "debounce_alert_sec": 60,
  "nx_bookmark": {
    "tag": "#restaurant_capacity",
    "title": "[CAPACITY ALERT] Restaurant Full"
  },
  "table_monitoring": {
    "enabled": true,
    "show_overlay": true,
    "show_labels": true,
    "dwell_time": {
      "enabled": true,
      "min_occupied_sec": 5.0,
      "empty_debounce_sec": 2.0,
      "alert_dwell_sec": 3600.0
    },
    "tables": [
      {
        "id": "T1",
        "name": "Table 1 (Front Left)",
        "capacity": 4,
        "polygon": [
          [
            0.22,
            0.48
          ],
          [
            0.44,
            0.48
          ],
          [
            0.45,
            0.95
          ],
          [
            0.21,
            0.95
          ]
        ]
      },
      {
        "id": "T2",
        "name": "Table 2 (Front Right Booth)",
        "capacity": 6,
        "polygon": [
          [
            0.99,
            0.62
          ],
          [
            0.78,
            0.44
          ],
          [
            0.71,
            0.83
          ],
          [
            0.98,
            0.98
          ]
        ]
      },
      {
        "id": "T3",
        "name": "Table 3 (Center)",
        "capacity": 4,
        "polygon": [
          [
            0.42,
            0.32
          ],
          [
            0.61,
            0.32
          ],
          [
            0.62,
            0.6
          ],
          [
            0.41,
            0.58
          ]
        ]
      },
      {
        "id": "T4",
        "name": "Table 4 (Mid Left)",
        "capacity": 4,
        "polygon": [
          [
            0.25,
            0.23
          ],
          [
            0.43,
            0.24
          ],
          [
            0.43,
            0.47
          ],
          [
            0.24,
            0.46
          ]
        ]
      },
      {
        "id": "T5",
        "name": "Table 5 (Far Left Window)",
        "capacity": 4,
        "confidence_threshold": 0.15,
        "polygon": [
          [
            0.08,
            0.22
          ],
          [
            0.22,
            0.21
          ],
          [
            0.25,
            0.38
          ],
          [
            0.1,
            0.42
          ]
        ]
      },
      {
        "id": "T6",
        "name": "Table 6 (Near Left Wall)",
        "capacity": 4,
        "polygon": [
          [
            0.0,
            0.45
          ],
          [
            0.15,
            0.42
          ],
          [
            0.21,
            0.75
          ],
          [
            0.02,
            0.97
          ]
        ]
      },
      {
        "id": "T7",
        "name": "Table 7 (Mid Right)",
        "capacity": 4,
        "polygon": [
          [
            0.55,
            0.22
          ],
          [
            0.7,
            0.22
          ],
          [
            0.71,
            0.46
          ],
          [
            0.55,
            0.46
          ]
        ]
      },
      {
        "id": "T8",
        "name": "Table 8 (Far Right Mezzanine)",
        "capacity": 4,
        "polygon": [
          [
            0.63,
            0.14
          ],
          [
            0.64,
            0.27
          ],
          [
            0.73,
            0.31
          ],
          [
            0.72,
            0.17
          ]
        ]
      },
      {
        "id": "T9",
        "name": "Table 9 (Far Center Bamboo)",
        "capacity": 4,
        "confidence_threshold": 0.12,
        "polygon": [
          [
            0.49,
            0.1
          ],
          [
            0.51,
            0.26
          ],
          [
            0.6,
            0.24
          ],
          [
            0.59,
            0.13
          ]
        ]
      },
      {
        "id": "T10",
        "name": "Table 10",
        "capacity": 4,
        "polygon": [
          [
            0.1,
            0.42
          ],
          [
            0.0,
            0.44
          ],
          [
            0.0,
            0.33
          ],
          [
            0.08,
            0.29
          ]
        ]
      },
      {
        "id": "T11",
        "name": "Table 11",
        "capacity": 4,
        "polygon": [
          [
            0.24,
            0.17
          ],
          [
            0.27,
            0.33
          ],
          [
            0.38,
            0.24
          ],
          [
            0.33,
            0.13
          ]
        ]
      },
      {
        "id": "T12",
        "name": "Table 12",
        "capacity": 4,
        "polygon": [
          [
            0.34,
            0.1
          ],
          [
            0.38,
            0.23
          ],
          [
            0.46,
            0.17
          ],
          [
            0.42,
            0.08
          ]
        ]
      },
      {
        "id": "T13",
        "name": "Table 13",
        "capacity": 4,
        "polygon": [
          [
            0.51,
            0.31
          ],
          [
            0.43,
            0.31
          ],
          [
            0.42,
            0.18
          ],
          [
            0.5,
            0.16
          ]
        ]
      },
      {
        "id": "T14",
        "name": "Table 14",
        "capacity": 4,
        "polygon": [
          [
            0.84,
            0.32
          ],
          [
            0.99,
            0.43
          ],
          [
            0.98,
            0.61
          ],
          [
            0.82,
            0.47
          ]
        ]
      },
      {
        "id": "T15",
        "name": "Table 15",
        "capacity": 4,
        "polygon": [
          [
            0.85,
            0.2
          ],
          [
            0.84,
            0.32
          ],
          [
            1.0,
            0.44
          ],
          [
            1.0,
            0.28
          ]
        ]
      }
    ]
  }
}
